{
  "errorCode": "errorCode",
  "callBackInfo": null,
  "success": false,
  "errorKind": "errorKind",
  "message": "message",
  "errorMessage": "errorMessage",
  "subAccounts": [
    {
      "subAccountId": "subAccountId",
      "name": "name",
      "postalCode": "postalCode",
      "customFields": {},
      "vendorIdentifiers": {}
    }
  ],
  "$schema": "./subaccount.response.schema.json"
}